company_name,website,email
Marsh & Parsons,https://www.marshandparsons.co.uk,customercare@marshandparsons.co.uk
Chestertons,https://www.chestertons.co.uk,hello@chestertons.co.uk
Johns&Co: London Estate Agents,https://www.johnsand.co,info@johnsand.co
London. Property.  We get it.,https://www.kfh.co.uk,enquiries@londonwideconveyancing.com
Stirling Ackroyd Estate Agents,https://www.stirlingackroyd.com,info@stirlingackroyd.com
Altogether better across London,https://www.dexters.co.uk,outreach@aktonz.com
Hamptons,https://www.hamptons.co.uk,clientservicesdepartment@hamptons.co.uk
What's your home worth?,https://www.acorngroup.co.uk,outreach@aktonz.com
